### ISSUE TITLE
在播放过程中如何再发送与流媒体服务端的Play命令？

### ISSUE THREAD

**Issue by ekfans** [CarGuo/GSYVideoPlayer#2495]
项目需要加快进和快退，但是快进快退是由流媒体服务器控制下发的流。按下快进或者快退的时候，需要发送play命令，并修改请求头里参数的值
![image](https://user-images.githubusercontent.com/7876177/71541529-60419c80-2995-11ea-9545-a9d6290abee5.png)
修改Scale为快进快退的数值，range改成npt=now-
这种情况该如何操作呢？感激不尽！！！
（安卓TV项目）

**Comment by ekfans** [comment]
Frame 50: 179 bytes on wire (1432 bits), 179 bytes captured (1432 bits) on interface 0
Point-to-Point Protocol
Internet Protocol Version 4, Src: 192.168.251.3, Dst: 115.153.215.106
Transmission Control Protocol, Src Port: 59568, Dst Port: 554, Seq: 2572, Ack: 1273, Len: 135
[2 Reassembled TCP Segments (676 bytes): #49(541), #50(135)]
Real Time Streaming Protocol
    Request [truncated]: PLAY rtsp://115.153.215.106:554/88888888/16/20190705/272626929/272626929.ts?rrsip=182.104.129.27&zoneoffset=480&icpid=129&accounttype=1&limitflux=-1&limitdur=-1&tenantId=8601&accountinfo=%2C105273962%2C111.75.220.66%2
    Range: npt=0.000-\r\n
    CSeq: 4\r\n
    User-Agent: testsss \r\n
    Scale: 1\r\n
    Session: 947047526
    \r\n


上面图片我这边没显示出来，就把抓包工具的内容复制过来了

**Comment by CarGuo** [comment]
不是很理解，但是如果我理解没错的话你这个需求我这边暂时是无法满足

**Comment by ekfans** [comment]
> 不是很理解，但是如果我理解没错的话你这个需求我这边暂时是无法满足

大神，目前正在测试的进度条小窗口预览是类似智能电视的快进快退么？
![image](https://user-images.githubusercontent.com/7876177/71611126-ac792080-2bd1-11ea-97ab-f46537224083.png)

**Comment by CarGuo** [comment]
现在的小窗口预览是通过 Glide 或者其他第三方工具去获取某个时间戳的帧，暂时只支持 http 的，rtsp 的真没有试过····
